,id,author_id,parent_id,parent_author_id,parent_author_name,type,author,body,created_utc,score,stickied,subreddit_id,title,full_link,media_only,num_comments,over_18,pinned,retrieved_on,subreddit,updated_utc,date,time,url,distinguished,edited,is_submitter,link_id,relevance
0,faxyua,4rqo0kif,,,,submission,GreenAtSunset,,1582909931,1,False,t5_2qn7a,Supervised injection site is no longer in the works.,https://www.reddit.com/r/Pennsylvania/comments/faxyua/supervised_injection_site_is_no_longer_in_the/,False,12,False,False,1582909932,Pennsylvania,,28-02-2020,09:12:11,https://www.nbcphiladelphia.com/news/local/supervised-injection-site-no-longer-opening-at-south-philly-plaza/2309477/,,,,,1
1,f9zcin,10zbow,,,,submission,oldbkenobi,,1582747823,1,False,t5_2qn7a,South Philly will get nation's first supervised injection site,https://www.reddit.com/r/Pennsylvania/comments/f9zcin/south_philly_will_get_nations_first_supervised/,False,14,False,False,1582747841,Pennsylvania,,26-02-2020,12:10:23,https://billypenn.com/2020/02/25/nothing-procedurally-improper-safehouse-injection-site-gets-judges-final-clearance/,,,,,1
2,b3uj2x,10zbow,,,,submission,oldbkenobi,,1553194989,2,False,t5_2qn7a,First supervised drug injection site in U.S. offered lease in Philadelphia’s Kensington district,https://www.reddit.com/r/Pennsylvania/comments/b3uj2x/first_supervised_drug_injection_site_in_us/,False,2,False,False,1553194990,Pennsylvania,1554234071.0,21-03-2019,12:03:09,https://www.philly.com/health/supervised-injection-site-drugs-philadelphia-kensington-lease-safehouse-hilton-street-20190321.html,,,,,1
3,anrkhn,10zbow,,,,submission,oldbkenobi,,1549465558,1,False,t5_2qn7a,Federal prosecutors sue to stop nation’s first planned ‘supervised injection site’ in Philly,https://www.reddit.com/r/Pennsylvania/comments/anrkhn/federal_prosecutors_sue_to_stop_nations_first/,False,9,False,False,1549465559,Pennsylvania,,06-02-2019,07:05:58,https://whyy.org/articles/federal-prosecutors-sue-to-stop-nations-first-planned-supervised-injection-site-in-philly/,,,,,1
4,fjg8321,,fjg147h,4n9a4a3d,wondertigger93,comment,TheBambooBoogaloo,That's exactly what supervised injection sites do.,1583316041,1,False,2qn7a,,,,0,,,,,,04-03-2020,02:00:41,,,,False,fd5qv0,1
5,fhska1y,,f4q0qn,,,comment,FalseArm,"&gt; The expansion being considered would make it illegal to smoke virtually anywhere but in your own home.

So you can't even smoke in your car? Sounds like we need to start having [supervised smoking sites](https://nursing.usc.edu/blog/supervised-injection-sites/).",1581861925,1,False,2qn7a,,,,0,,,,,,16-02-2020,06:05:25,,,,False,f4q0qn,1
6,e613fj3,,e5xzo4h,,butt-mudd-brooks,comment,duggabboo,A euphemism is an attempt to make something bad look better. Supervised injection is not a bad thing.,1537032614,2,False,2qn7a,,,,0,,,,,,15-09-2018,10:30:14,,,,False,9fm0j6,1
7,e5xtn1w,,9fm0j6,hygt8,,comment,butt-mudd-brooks,"""Overdose Prevention Site"" is a funny way of saying ""Supervised Injection Site""",1536886288,-3,False,2qn7a,,,,0,,,,,,13-09-2018,17:51:28,,,,False,9fm0j6,1
8,djf3bik,,6izmus,ysm9i,,comment,schudm,This is such a huge issue in the US and Canada. The American Medical Association has even [OKed pilot supervised injection sites](http://wskgnews.org/post/ama-we-endorse-pilot-supervised-injection-facilities) to try and stop overdose deaths and maybe get hard data on how huge this epidemic really is. ,1498488561,1,False,2qn7a,,,,0,,,,,,26-06-2017,07:49:21,,,,,6izmus,1
